Question,Subject,Answer,A,B,C,D,DEEP_SEEK,OPEN_AI,GEMINI,LLAMA
‘আনারস’ এবং ‘চাবি’ শব্দ দুটি বাংলা ভাষা গ্রহণ করেছে-,BANGLA-LANGUAGE,A,পর্তুগিজ ভাষা হতে,আরবি ভাষা হতে,দেশী ভাষা হতে,ওলন্দাজ ভাষা হতে,A,A,A,A
শুদ্ধ বানান কোনটি?,BANGLA-LANGUAGE,B,মূমুর্ষু,মুমূর্ষু,মূমূর্ষ,মুমূর্ষ,B,B,B,B
গুরুচণ্ডালী দোষমুক্ত কোনটি?,BANGLA-LANGUAGE,C,শবপোড়া,মড়াদাহ,শবদাহ,শবমড়া,C,A,A,C
‘কবর’ নাটকটির লেখক-,BANGLA-LITERATURE,C,জসীমউদ্দীন,নজরুল ইসলাম,মুনীর চৌধুরী,দ্বিজেন্দ্রলাল রায়,C,A,A,C
‘উভয়কূল রক্ষা’ অর্থে ব্যবহৃত প্রবচন কোনটি?,BANGLA-LANGUAGE,C,"কারো পৌষ মাস, কারো সর্বনাস","চাল না চুলো, ঢেঁকী না কুলো","সাপও মরে, লাঠিও না ভাঙ্গে","বোঝার উপর, শাকের আঁটি",C,C,C,C
শুদ্ধ বাক্য কোনটি?,BANGLA-LANGUAGE,C,দুর্বলবশত অনাথিনী বসে পড়া,দুর্বলতাবশতঃ অনাথিনী বসে পড়ল,দুর্বলতাবশত অনাথা বসে পড়ল,দুর্বলবশত অনাথা বসে পড়ল,B,B,B,B
ক্রিয়া পদের মূল অংশকে বলা হয়-,BANGLA-LANGUAGE,B,বিভক্তি,ধাতু,প্রত্যয়,কৃৎ,B,B,B,B
‘রত্নাকর’ শব্দটির সন্ধি বিচ্ছেদ-,BANGLA-LANGUAGE,D,রত্না + কর,রত্ন + কর,রত্না + আকার,রত্ন + আকর,D,A,B,B
কোন দ্বিরুক্ত শব্দজুটি বহুবচন সংকেত করে?,BANGLA-LANGUAGE,A,পাকা পাকা আম,ছি ছি কি করছ,নরম নরম হাত,উড়ু উড়ু মন,A,A,A,A
কোন প্রবচন বাক্য ব্যবহারিক দিক হতে সঠিক?,BANGLA-LANGUAGE,B,যত গর্জে তত বৃষ্টি হয় না,অধিক সন্ন্যাসীতে গাজন নষ্ট,নাচতে না জানলে উঠোন ভাঙ্গা,যেখানে বাঘের ভয় সেখানে বিপদ হয়,B,A,A,B
বাংলায় টি.এস. এলিয়টের কবিতার প্রথম অনুবাদক–,BANGLA-LITERATURE,A,রবীন্দ্রনাথ ঠাকুর,বিষ্ণু দে,সুধীন্দ্রনাথ দত্ত,বুদ্ধদেব বসু,D,C,A,C
‘অগ্নিবীণা’ কাব্যগ্রন্থে সংকলিত প্রথম কবিতা–,BANGLA-LITERATURE,C,অগ্রপথিক,বিদ্রোহী,প্রলয়োল্লাস,ধূমকেতু,B,A,A,B
‘শেষের কবিতা’ রবীন্দ্রনাথ রচিত–,BANGLA-LITERATURE,C,কবিতার নাম,গল্প সংকলনের নাম,উপন্যাসের নাম,কাব্য সংকলনের নাম,C,C,A,D
কোন বাক্যে ‘মাথা’ শব্দটি বুদ্ধি অর্থে ব্যবহৃত?,BANGLA-LANGUAGE,B,তিনিই সমাজের মাথা,মাথা খাটিয়ে কাজ করবে,লজ্জায় আমার মাথা কাটা গেল,মাথা নেই তার মাথা ব্যথা,B,B,B,B
কোন শব্দে বিদেশি উপসর্গ ব্যবহৃত হয়েছে?,BANGLA-LANGUAGE,D,নিখুঁত,আনমনা,অবহেলা,নিমরাজী,D,B,B,C
‘আমার ভাইয়ের রক্তে রাঙানো ২১শে ফেব্রুয়ারি’র রচয়িতা কে?,BANGLA-LITERATURE,D,শামসুর রাহমান,আলতাফ মাহমুদ,হাসান হাফিজুর রহমান,আব্দুল গাফ্ফার চৌধুরী,D,D,A,A
কোনটি তদ্ভব শব্দ?,BANGLA-LANGUAGE,A,চাঁদ,সূর্য,নক্ষত্র,গগন,A,A,A,D
বাংলায় কোরআন শরীফের প্রথম অনুবাদক কে?,BANGLA-LITERATURE,B,কেশব চন্দ্র সেন,গিরিশচন্দ্র সেন,মাওলানা মনিরুজ্জামান ইসলামাবাদী,মওলানা আকরাম খাঁ,B,C,A,B
Choose the correct alternative to complete the sentence? ‘He–to see us if he had been able to.’,ENGLISH-LANGUAGE,B,would come,would have come,may have come,may come,B,B,B,B
Choose the appropriate alternative to complete the sentence. ‘He had a– of fever.’,ENGLISH-LANGUAGE,B,strong attack,severe attack,serious kind,bad attack,B,B,B,B
Choose the correct sentence.,ENGLISH-LANGUAGE,B,I asked Javed had he passéd,I asked Javed if he had passed,I asked Javed if you had passed,I asked Javed that had he passed,B,B,B,B
Choose the correct sentence.,ENGLISH-LANGUAGE,B,A few of the three boys got a prize,Each of the three boys got a prize,Every of the three boys got a prize,All of the three boys got a prize,B,D,B,B
Choose the correct sentence.,ENGLISH-LANGUAGE,B,The man that said that was a fool,The man who said that was a fool,The man that said that was a fool,The man which said that was a fool,B,B,B,B
Choose the correct answer. How long did you wait?,ENGLISH-LANGUAGE,B,Till lunch time,Till he came,Until six o’clock,Since this morning,B,B,C,C
What will be correct preposition to complete the sentence? ‘I am not bad ____ tennis’.,ENGLISH-LANGUAGE,B,in,at,about,with,D,B,D,D
What is the antonym of ‘gentle’?,ENGLISH-LANGUAGE,D,harsh,modest,clever,rude,A,A,A,D
What is the synonym of ‘Jovial’?,ENGLISH-LANGUAGE,,Jolly,Gay,Jealous,Happy,A,A,A,A
What is the synonym of ‘Competent’?,ENGLISH-LANGUAGE,C,Circumspect,Discrete,Capable,Prudent,C,C,C,C
Who is the author of ‘A Farewell to Arms’?,ENGLISH-LITERATURE,D,H. G. Wells,George Orwel,Thomas Hardy,Ernest Hemingway,D,D,D,D
Who is the author of ‘Animal Farm’?,ENGLISH-LITERATURE,B,Thomas more,George Orwel,Boris Pasternak,Charles Dickens,B,B,B,B
Who is the author of ‘India Wins Freedom’?,ENGLISH-LITERATURE,C,Mahatma Gandhi,J. L. Nehru,Abul Kalam Azad,Moulana Akram Khan,C,C,B,C
What kind of noun is ‘Cattle’?,ENGLISH-LANGUAGE,C,Proper,Common,Collective,Material,C,C,C,C
What kind of noun is ‘Girl’?,ENGLISH-LANGUAGE,B,Proper,Common,Collective,Material,B,B,B,B
What is the meaning of ‘White Elephant’?,ENGLISH-LANGUAGE,B,An elephant of white colour,A very coslty or troublesome possession,A black marketer,A hoarder,B,B,B,B
বাংলাদেশ গণপ্রজাতন্ত্রের ঘোষণা ছিলো–,BANGLADESH-AFFAIRS,A,"১৭ এপ্রিল, ১৯৭১","২৬ মার্চ, ১৯৭১","১১ এপ্রিল, ১৯৭১","১০ জানুয়ারি, ১৯৭২",B,A,B,B
গণপ্রজাতন্ত্রী বাংলাদেশের সংবিধান প্রবর্তিত হয়–,BANGLADESH-AFFAIRS,B,"১৭ এপ্রিল, ১৯৯১","১৬ ডিসেস্বর, ১৯৭২","৭ মার্চ, ১৯৭২","২৬ মার্চ, ১৯৭৩",B,B,B,D
বিখ্যাত সাধক শাহ্ সুলতান বলখীর মাজার কোথায়?,BANGLADESH-AFFAIRS,A,মহাস্থানগড়ে,শাহজাদপুরে,নেত্রকোনায়,রামপালে,C,A,A,B
বাংলাদেশের লোক শিল্প জাদুঘর কোথায় অবস্থিত?,BANGLADESH-AFFAIRS,C,চট্টগ্রামে,বগুড়ায়,সোনারগাঁওয়ে,রামপালে,C,C,C,C
বাংলায় ইউরোপীয় বণিকদের মধ্যে বাণিজ্যের উদ্দেশ্যে প্রথম এসেছিল-,BANGLADESH-AFFAIRS,D,ইংরেজরা,ওলন্দজরা,ফরাসিরা,পর্তুগিজরা,D,D,D,D
বাংলা নববর্ষ পহেলা বৈশাখ চালু করেছিলেন-,BANGLADESH-AFFAIRS,C,লক্ষ্মণ সেন,ইলিয়াস শাহ,আকবর,বিজয় সেন,C,C,A,C
পাহাড়পুরের বৌদ্ধ বিহারটি কি নামে পরিচিত ছিল?,BANGLADESH-AFFAIRS,A,সোমপুর বিহার,ধর্মপাল বিহার,জগদ্দল বিহার,শ্রী বিহার,A,A,A,Answer: B
বাংলাদেশে চীনামাটির সন্ধান পাওয়া গেছে–,BANGLADESH-AFFAIRS,A,বিজয়পুরে,রানীগঞ্জে,টেকেরহাটে,বিয়ানী বাজারে,A,A,B,C
ঢাকা বিশ্ববিদ্যালয় প্রতিষ্ঠিত হয়–,BANGLADESH-AFFAIRS,C,১৮৯৭ সালে,১৯০২ সালে,১৯২১ সালে,১৯০৫ সালে,C,C,C,C
ঢাকার বিখ্যাত তারা মসজিদ তৈরী করনে–,BANGLADESH-AFFAIRS,C,শায়েস্তা খান,নওয়াব সলিমুল্লাহ,মির্জা আহমেদ জান,খান সাহেব আবুল হাসনাত,C,A,A,C
পাখি ছাড়া ‘বলাকা’ও ‘দোয়েল’ নামে পরিচিত হচ্ছে-,BANGLADESH-AFFAIRS,A,দু’টি উন্নত জাতের গমশস্য,দু’টি উন্নত জাতের ধানশস্য,দু’টি উন্নত জাতের ভুট্টাশস্য,দু’টি উন্নতজাতের ইক্ষু,B,B,B,B
"‘অগ্নিশ্বর’, ‘কানাইবাঁসি’, ‘মোহনবাঁশী’ ও ‘বীটজবা’ কি জাতীয় ফলের নাম?",BANGLADESH-AFFAIRS,B,পেয়ারা,কলা,পেঁপে,জামরুল,B,A,A,A
বাংলায় চিরস্থায়ী বন্দোরস্ত প্রথা প্রবর্তন করা কোন সালে?,BANGLADESH-AFFAIRS,D,১৭০০ সালে,১৭৭২ সালে,১৭৬৫ সালে,১৭৯৩ সালে,D,B,B,D
কোন মুঘল সম্রাট বাংলার নাম দেন ‘জান্নাতাবাদ’?,BANGLADESH-AFFAIRS,B,বাবর,হুমায়ুন,আকবর,জাহাঙ্গীর,C,C,B,D
উপমহাদেশীয়দের মধ্যে ঢাকা বিশ্ববিদ্যালয়ের প্রথম ভাইস চ্যান্সেলর-,BANGLADESH-AFFAIRS,D,ড. রমেশচন্দ্র মজুমদার,ড. মাহমুদ হাসান,ড. সৈয়দ মোয়াজ্জেম হোসেন,স্যার এ. এফ. রহমান,A,A,A,A
১৯৮৮ সালের সিউল অলিম্পিকে বাংলাদেশের কোন ভাস্করের শিল্পকর্ম প্রদর্শনীতে স্থান পায়?,BANGLADESH-AFFAIRS,C,শামীম সিকদার,সৈয়দ আব্দুল্লাহ খালেদ,হামিদুজ্জামান খান,আবদুস সুলতান,B,A,A,B
ঢাকায় সর্বপ্রথম কবে বাংলার রাজধানী স্থাপিত হয়?,BANGLADESH-AFFAIRS,D,১২০৬ খ্রিঃ,১৩১০ খ্রিঃ,১৫২৬ খ্রিঃ,১৬১০ খ্রিঃ,D,A,B,D
‘পূর্বাশা’ দ্বীপের অপর নাম–,BANGLADESH-AFFAIRS,C,নিঝুম দ্বীপ,সেন্টমার্টিন দ্বীপ,দক্ষিণ তালপট্টি দ্বীপ,দিয়া দ্বীপ,C,A,B,B
সার্ক-এর প্রথম শীর্ষ বৈঠক অনুষ্ঠিত হয়–,INTERNATIONAL-AFFAIRS,C,১৯৮৪ সালে,১৯৮৭ সোলে,১৯৮৫ সালে,১৯৮৬ সালে,C,A,A,C
আরব রাষ্ট্রগুলোর মধ্যে কোনটি বাংলাদেশকে প্রথম স্বীকৃতি দেয়?,INTERNATIONAL-AFFAIRS,A,ইরাক,আলজেরিয়া,সৌদি আরব,জর্ডান,A,A,A,B
পিএলও-এর সদর দপ্তর–,INTERNATIONAL-AFFAIRS,,তিউনিস,রাবাত,বেনগাজি,মরক্কো,A,B,A,A
জাতিসংঘের প্রথম মহাসচিব ছিলেন–,INTERNATIONAL-AFFAIRS,B,উ থান্ট,ট্রিগভেলি,দ্যাগ হ্যামারশোল্ড,কুট ওয়াল্ডহেইম,B,B,B,B
নিরাপত্তা পরিষদের এশীয় আসনে বাংলাদেশের প্রতিদ্বন্দ্বী ছিল–,INTERNATIONAL-AFFAIRS,B,ফিলিপাইন,জাপান,ইন্দোনেশিয়া,থাইল্যান্ড,B,A,A,A
সাধারণ পরিষদের নিয়মিত অধিবেশন শুরু হয়–,INTERNATIONAL-AFFAIRS,A,সেপ্টেম্বর মাসের তৃতীয় মঙ্গলবার,সেপ্টেম্বর মাসের প্রথম সোমবার,সেপ্টেম্বর মাসের দ্বিতীয় বুধবার,সেপ্টেম্বর মাসের চতুর্থ মঙ্গলবার,A,A,A,A
বর্তমান জাতিসংঘের সদস্য সংখ্যা–,INTERNATIONAL-AFFAIRS,,১৫৬,১৫৭,১৫৮,১৮৮,D,B,C,D
ইসলাম সম্মেলন সংস্থার সচিবলায় অবস্থিত–,INTERNATIONAL-AFFAIRS,B,রিয়াদ,জেদ্দা,দামেস্ক,মক্কা,B,B,B,B
যে দেশ এসডিআই প্রতিরক্ষা কর্মসূচি গ্রহণ করেছে–,INTERNATIONAL-AFFAIRS,C,ব্রিটেন,ফ্রান্স,যুক্তরাষ্ট্র,রাশিয়া,C,C,C,C
ব্রিটিনের প্রশাসনিক সদর দপ্তরকে বলা হয়–,INTERNATIONAL-AFFAIRS,B,ওয়েস্ট মিনিস্টার অ্যাবে,হোয়াইট হল,মার্বেল চার্চ,বুশ হাউজ,B,B,B,B
দ্বিতীয় মহাযুদ্ধে জার্মানি আত্মসমর্পণ করে–,INTERNATIONAL-AFFAIRS,C,১৯৪২ সালের নভেম্বর মাসে,১৯৪৩ সালের ফেব্রুয়ারি মাসে,১৯৪৫ সালের মে মাসে,১৯৪৫ সালের সেপ্টেম্বর মাসে,C,C,C,C
কঙ্গোকে বিদেশি শাসন থেকে মুক্ত করার লড়াইয়ে চিরস্থায়ী নাম–,INTERNATIONAL-AFFAIRS,B,কাশাভুবু,প্যাট্রিক লুমুম্বা,শোম্বে,মবুতু,B,B,B,B
হিরোশিমায় এটম বোম ফেলা হয়েছিল–,INTERNATIONAL-AFFAIRS,A,১৯৪৫ সালেরর আগস্ট মাসে,১৯৪৫ সালের মে মাসে,১৯৪৫ সালের সেপ্টেম্বর মাসে,১৯৪৪ সালের আগস্ট মাসে,A,A,A,A
আইএমএফ-এর সদর দপ্তর কোথায়?,INTERNATIONAL-AFFAIRS,A,ওয়াশিংটন,মস্কো,লন্ডন,নিউইয়র্ক,A,A,A,A
নিকারাগুয়ায় যে বিদ্রোহীদের যুক্তরাষ্ট্র সমর্থন করে তার নাম–,INTERNATIONAL-AFFAIRS,C,ইউনিটা,সান্ডিনিস্টা,কন্ট্রা,সোয়াপো,C,C,C,C
‘ব্যাবিলনের ঝুলন্ত উদ্যান’ কোন দেশে অবস্থিত?,INTERNATIONAL-AFFAIRS,B,ইরান,ইরাক,মিশর,সিরিয়া,B,B,B,B
ইতিহাস বিখ্যাত ট্রয় নগরী কোথায়?,INTERNATIONAL-AFFAIRS,C,ইতালি,স্পেন,তুরস্ক,গ্রিস,C,C,D,C
নিচের কোন সংখ্যাটি মৌলিক?,MATHEMATICAL-REASONING,C,৯১,১৪৩,৪৭,৮৭,C,A,C,C
কোনো একটি জিনিস নির্মাতা ২০% লাভে ও খুচরা বিক্রেতা ২০% লাভে বিক্রয় করে। যদি ঐ জিনিসের নির্মাণ খরচ ১০০ টাকা হয় তবে খুচরা মূল্য কত?,MATHEMATICAL-REASONING,C,১৪০ টাকা,১২০ টাকা,১৪৪ টাকা,১২৪ টাকা,C,C,C,C
সমবাহু ত্রিভূজের বাহুর দৈর্ঘ্য যদি ‘a’ হয় তবে ক্ষেত্রফল হবে-,MATHEMATICAL-REASONING,A,\[\mathrm{{\sqrt{৩} \over ৪} a^2}\],\[\mathrm{\sqrt{{{৩} \over ২} a^2}}\],\[\mathrm{{{৩} \over২} a^2}\],\[\mathrm{\sqrt{{{১} \over ২}a^2}}\],A,A,A,A
১ থেকে ৪৯ পর্যন্ত সংখ্যার গড় কত?,MATHEMATICAL-REASONING,C,২৩,২৪.৫,২৫,২৬.৫,C,B,B,B
টাকায় তিনটি করে আম ক্রয় করে টাকায় ২টি করে বিক্রয় করলে শতকরা কত লাভ হবে?,MATHEMATICAL-REASONING,A,৫০%,৩৩%,৩০%,৩১%,A,B,A,A
"ত্রিভুজ ABC এর BE = FE = CF। AEC এর ক্ষেত্রফল ৪৮ বর্গফুট হলে, ত্রিভুজ ABC এর ক্ষেত্রফল কত বর্গফুট?",MATHEMATICAL-REASONING,A,৭২,৬০,৪৮,৬৪,A,A,A,B
\(\mathrm{a+b=5}\) এবং \(\mathrm{a-b=3}\) হলে ab এর মান কত?,MATHEMATICAL-REASONING,C,2,3,4,5,C,B,A,B
৬০ লিটার কেরোসিনের ও পেট্রোলের মিশ্রণের অনুপাত ৭ : ৩। ঐ মিশ্রণে কত লিটার পেট্রোল মিশালে অনুপাত ৩ : ৭ হবে ?,MATHEMATICAL-REASONING,B,৭০,৮০,৯০,৯৮,B,B,B,B
১ হতে ৩০ পর্যন্ত কয়টি মৌলিক সংখ্যা আছে?,MATHEMATICAL-REASONING,C,১১টি,৮টি,১০টি,৯টি,C,A,A,A
দুটি সংখ্যার গুণফল ১৫৩৬। সংখ্যা দুটোর ল.সা.গু ৯৬ হলে গ.সা.গু. কত?,MATHEMATICAL-REASONING,A,১৬,২৪,৩২,১২,A,A,A,B
\({.1 \times .01 \times .001 \over.2 \times .02 \times .002}\) এর মান কত?,MATHEMATICAL-REASONING,D,\({1 \over 80}\),\({1 \over 800}\),\({1 \over 8000}\),\({1 \over 8}\),A,C,C,A
সরল সুদের হার শতকরা কত টাকা হলে যে কোনো মূলধন ৮ বছরে সুদে – আসলে তিনগুণ হবে?,MATHEMATICAL-REASONING,C,১২.৫০ টাকা,২০ টাকা,২৫ টাকা,১৫ টাকা,C,A,C,A
চিনির মূল্য ২৫% বৃদ্ধি পাওয়াতে একটি পরিবার চিনি খাওয়া এমনিভাবে কমালো যে চিনি বাবদ ব্যয় বৃদ্ধি পেল না। ঐ পরিবার চিনি খাওয়ার খরচ শতকার কত কমিয়েছিল?,MATHEMATICAL-REASONING,C,২২%,২৫%,২০%,৩০%,C,D,A,C
যদি \({\mathrm{(x-5) (a+x) = x^2-25}}\) তবে \({\mathrm{a}}\) এর মান কত?,MATHEMATICAL-REASONING,B,\({-5}\),\({5}\),\({25}\),\({-25}\),B,C,A,B
\({\mathrm{a + b + c = 0}}\) হলে \({\mathrm{a^3+ b^3+ c^3}}\) এর মান কত?,MATHEMATICAL-REASONING,B,\({\mathrm{abc}}\),\({\mathrm{3abc}}\),\({\mathrm{6abc}}\),\({\mathrm{9abc}}\),B,B,B,3abc
ত্রিভুজের একটি কোণ এর অপর দুটি কোণের সমষ্টির সমান হলে ত্রিভুজটি–,MATHEMATICAL-REASONING,A,সমকোণী,স্হুলকোণী,সমবাহু,সূক্ষ্মকোণী,A,A,A,A
নবায়নযোগ্য শক্তি উৎসের একটি উদাহরণ হলো–,GENERAL-SCIENCE,D,পারমাণবিক জ্বালানি,পীট কয়লা,ফুয়েল সেল,সূর্য,D,D,D,D
পেসার কুকারে রান্না তাড়াতাড়ি হয় কারণ–,GENERAL-SCIENCE,C,রান্নার জন্য তাপ নয় চাপও কাজে লাগে,বদ্ধ পাত্রে তাপ সংরক্ষিত হয়,উচ্চচাপে তরলের স্ফুটনাংক বৃদ্ধি পায়,সঞ্চিত বাষ্পের তাপ রান্নায় সহায়ক,C,C,A,A
যে তিনটি মুখ্য বর্ণের সমন্বয়ে অন্যান্য বর্ণ সৃষ্টি করা যায় সেগুলো হলো–,GENERAL-SCIENCE,D,"লাল, হলুদ, নীল","লাল, কমলা, বেগুনী","হলুদ, সবুজ, নীল","লাল, নীল, সবুজ",A,A,A,A
ভৌগলিকভাবে গুরুত্বপূর্ণ যে কাল্পনিক রেখাটি বাংলাদেশের উপর দিয়ে গিয়েছে তা হলো–,GENERAL-SCIENCE,B,মূল মধ্যরেখা,কর্কটক্রান্তি রেখা,মকরক্রান্তি রেখা,আন্তর্জাতিক তারিখ রেখা,B,B,B,B
মাছ অক্সিজেন নেয়–,GENERAL-SCIENCE,D,মাঝে মাঝে পানির উপর নাক তুলে,পানিতে অক্সিজেন ও হাইড্রোজেন বিশ্লিষ্ট করে,পটকার মধ্যে জমানো বাতাস হতে,পানির মধ্যে দ্রবীভূত বাতাস হতে,D,D,D,D
কচুশাক বিশেষভাবে মূল্যবান যে উপাদানের জন্য তা হলো–,GENERAL-SCIENCE,C,ভিটামিন-‘এ’,ভিটামিন-‘সি’,লৌহ,ক্যালসিয়াম,C,C,B,B
সাধারণ ড্রাইসেলে ইলেকট্রোড হিসাবে থাকে–,GENERAL-SCIENCE,C,তামার দণ্ড ও দস্তারর দণ্ড,তামার পাত ও দস্তার পাত,কার্বন দণ্ড ও দস্তার কৌটা,তামার দণ্ড ও দস্তার কৌটা,C,D,C,C
দূরের বিদ্যুৎ উৎপাদন কেন্দ্র হতে বিদ্যুৎ নিয়ে আসতে হলে হাইভোল্টেজ ব্যবহার করার কারণ–,GENERAL-SCIENCE,A,এতে বিদ্যুতের অপচয় কম হয়,এতে কমে গিয়েও প্রয়োজনীয় ভোল্টেজ বজায় থাকে,অধিক বিদ্যুৎ প্রবাহ পাওয়া যায়,প্রয়োজনমতো ভোল্টজ কমিয়ে ব্যবহার করা যায়,A,A,A,A
সংকর ধাতু পিতলের উপাদান হলো–,GENERAL-SCIENCE,B,তামা ও টিন,তামা ও দস্তা,তামা ও নিকেল,তামা ও সীসা,B,B,B,A
আমাদের দেহকোষ রক্ত হতে গ্রহণ করে–,GENERAL-SCIENCE,A,অক্সিজেন ও গ্লুকোজ,অক্সিজেন ও রক্তের আমিষ,ইউরিয়া ও গ্লুকোজ,এমাইনো এসিড ও কার্বন ডাইঅক্সাইড,A,A,A,A
পৃথিবীর ঘূর্ণনের ফলে আমরা ছিটকিয়ে পড়ি না–,GENERAL-SCIENCE,B,মহাকর্ষ বলের জন্য,মাধ্যাকর্ষণ বলের জন্য,আমরা স্থির থাকার জন্য,পৃথিবীর সঙ্গে আমাদের আবর্তনের জন্য,B,B,B,A
নিচের কোনটি জীবাশ্ম জ্বালানি নয়?,GENERAL-SCIENCE,D,পেট্রোলিয়াম,কয়লা,প্রাকৃতিক গ্যাস,বায়োগ্যাস,D,D,D,D
