Question,Subject,Answer,A,B,C,D,DEEP_SEEK,OPEN_AI,GEMINI,LLAMA
কম্পিউটারের সফটওয়্যার বলতে বুঝানো হয়–,COMPUTER-AND-INFORMATION-TECHNOLOGY,A,এর প্রোগ্রাম বা কর্ম পরিকল্পনার কৌশল,তথ্য দেয়া ও তথ্য নেয়ার অংশ বিশেষ,যেসব অংশ মুদ্রায়িত অবস্থায় থাকে,কম্পিউটার তৈরির নকশা,A,A,A,
মাইক্রোওয়েভের মাধ্যমে যে টেলিযোগাযোগ ব্যবস্থা আমাদের দেশে প্রচলিত তাতে মাইক্রোওয়েভ অধিকাংশ দূরত্ব অতিক্রম করে–,COMPUTER-AND-INFORMATION-TECHNOLOGY,A,ওয়েভ গাইডের মধ্য দিয়ে,ভূমি ও আয়নোস্ফিয়ারের মধ্যে প্রতিফলন হতে হবে,বিশেষ ধরনের ক্যাবলের মধ্য দিয়ে,খোলামেলা জায়গার মধ্য দিয়ে সরল রেখায়,D,D,D,
মানুষের ক্রোমোজোমের সংখ্যা কত?,GENERAL-SCIENCE,C,২৪ জোড়া,২৬ জোড়া,২৩ জোড়া,২৫ জোড়া,C,C,C,
সৌরকোষের বিদ্যুৎ রাতেও ব্যবহার করা সম্ভব যদি এর সঙ্গে থাকে–,GENERAL-SCIENCE,C,ট্রান্সফরমার,জেনারেটর,ষ্টোরেজ ব্যাটারি,ক্যাপামিটার,C,C,C,
বৈদ্যুতিক পাখা ধীরে ধীরে ঘুরলে বিদ্যুৎ খরচ–,GENERAL-SCIENCE,A,একই হয়,বেশি হয়,কম হয়,খুব কম হয়,A,C,B,
